File Name,record_id,Identified Commodities
NI 43-101 Technical Report for the Fyre Lake Project in North America dated January 2006.pdf,029d3857075e25b54cbf09988c27d5e7534049bf4f419dac8be07e757ceeaa4389,"cobalt, copper, gold, silver, zinc"
NI 43-101 Technical Report for the Fyre Lake Project in Canada dated February 2018.pdf,02269b8efd41adc7a9cdd6da11a940fbd289c4751c2479ff0de225195de026b35c,"cobalt, copper, gold, sulfur, nickel, silver, zinc"
NI 43-101 Technical Report for the Marg Project in North America dated May 2011.pdf,0270ee33efb40af75b9754f7cbe686f32101f4473dee9b96994500a3a6ac569671,"copper, lead, zinc, silver, gold"
"NI 43-101 Technical Report for the KSM project in Canada dated August, 2022.pdf",021c5868ee2f57be52a95875e112957e460b69671438935548f9d8147b50c57cc2,"gold, copper, silver, molybdenum"
NI 43-101 Technical Report for the Mount Polley Project in North America dated August 2002.pdf,02315a128c4bdf6c8c750f13b874b11674810393494c5784f2355d879af8a1a7a2,"copper, gold, silver"
NI 43-101 Technical Report for the Voiseys Bay Project in North America dated August 2003.pdf,0206221f1ea555c7c361ef2ceca56c5d021ebc89104e4dd91a72e1e4a919b99a20,"nickel, copper, cobalt, lead, zinc, sulfur, iron"
NI 43-101 Technical Report for the Mayville-Makwa Project in North America dated April 2014.pdf,023c0ec1005ee4a01f522bc452171a1cbc60105d23d2c0c94b55a82c3686defcf2,"cobalt, copper, gold, nickel, palladium, platinum"
NI 43-101 Technical Report for the McCreedy West Project in North America dated August 2003.pdf,0233825877b41a6e348ee6a443763c95b0d99d28f14408b40bb09cc64cf99ab675,"nickel, copper, cobalt, platinum, palladium, gold, iron, lead, zinc"
"NI 43-101 Technical Report for the Kutcho project in Canada dated November, 2021.pdf",02bc5ff7530ee386186571f1004fbd1e4031ca758a99dd8d513e3a2b03bf0440b0,"copper, zinc, silver, gold"
NI 43-101 Technical Report for the Catface Project in North America dated February 2004.pdf,024e988fb92687007735355ba7d60fd4ee70a915cd527c6093452a2101ee13d85d,"copper, molybdenum, gold, silver"
NI 43-101 Technical Report for the Troilus Project in Canada dated July 2020.pdf,021a33099b29624e93040cb005e5d42633b515b059f3cb9291e207df77471b611d,"gold, copper, silver"
NI 43-101 Technical Report for the Brunswick Belt Project in Canada dated May 2020.pdf,02d05f67ed0fa0dd68f7ffb7f0196853130437d584165267fe86e5cac989d977d6,"zinc, lead, copper, silver"
NI 43-101 Technical Report for the Minto Project in Canada dated March 2021.pdf,026201e26abf65793d6b5944f6c94059d2864fa823bbf4cae7c778d2375fd0777c,"copper, gold, silver"
NI 43-101 Technical Report for the Prosperity Project in North America dated 2009.pdf,02af1267668f4151e780e79bb27954215c70442f2d9be82c947e01fe88bfb1d482,"gold, copper"
NI 43-101 Technical Report for the Broken Hammer Project in North America dated July 2012.pdf,023250ddf7145084c86428ca7c2a24a095b100e5752d9ccd8c565ee3d43c39d5c3,"copper, nickel, gold, platinum, palladium, silver"
NI 43-101 Technical Report for the Marathon Project in Canada dated January 2020.pdf,02ec9be408716e18de6490368cc6dac5aab6303ce4cd58531e5dfc8568d3aaea77,"palladium, platinum, copper, gold, silver"
NI 43-101 Technical Report for the New Afton Project in Canada dated 2019.pdf,02cce6d2b2b79e8f6240dd72209bf1268ce02a156121340363f9f2874293b65af4,"copper, gold, silver, palladium, mercury, arsenic, antimony"
NI 43-101 Technical Report (OM) for the Huckleberry Project in North America dated 2016.pdf,021a0738f6a255dfdb40baea286e391aa6eada08979d9d46d23d6d4fec54793f84,"copper, molybdenum, gold, silver"
"NI 43-101 Technical Report for the Corner Bay-Devlin project in Canada dated November, 2021.pdf",029037f82249d67d23cf3b3bc1eb7de5e81e6056cef602f07e93f8f2831b2c981e,"copper, gold, pyrite, pyrrhotite, sphalerite, molybdenite"
